{
  "codepoint": "U+88C2",
  "traditional": "裂",
  "simplified": "裂",
  "simplification_note": null,
  "variants_異體字": [],
  "radical": {
    "kangxi_number": 145,
    "residual_strokes": 6,
    "source_assignment": "145.6",
    "additional_assignments": []
  },
  "total_strokes": 12,
  "total_strokes_standard": "TW-MOE-1996",
  "stroke_count_variants": [],
  "ids_decomposition": "⿱列衣",
  "components": [
    "U+5217",
    "U+8863"
  ],
  "liushu_六書": {
    "source_type": "pictophonetic",
    "type": "形聲",
    "semantic_component": "U+8863",
    "phonetic_component": "U+5217",
    "hint": "cloth"
  },
  "readings": {
    "pinyin": [
      {
        "reading": "liè",
        "context": "primary",
        "region": "TW",
        "standard": "TW-MOE-Revised-2015",
        "source_entry_ids": [
          "03505"
        ]
      }
    ],
    "zhuyin": [
      "ㄌㄧㄝˋ"
    ],
    "pinyin_variants": [
      {
        "reading": "liě",
        "region": "und",
        "classification": "dictionary_attestation",
        "source_id": "unicode-unihan-17.0.0",
        "source_property": "kHanyuPinyin"
      }
    ],
    "jyutping": [
      "lit6"
    ],
    "japanese_on": [
      "RETSU"
    ],
    "japanese_kun": [
      "SAKU",
      "SAKERU"
    ],
    "korean": [
      "LYEL"
    ],
    "fanqie": [
      "良辥"
    ],
    "hangul": [
      "렬",
      "열"
    ]
  },
  "definitions": [
    {
      "gloss": "split, crack, break open; rend",
      "lang": "en",
      "register": "modern",
      "source_id": "unicode-unihan-17.0.0"
    },
    {
      "gloss": "to split",
      "lang": "en",
      "register": "modern",
      "source_id": "cc-cedict-editor-2026-08-11"
    },
    {
      "gloss": "to crack",
      "lang": "en",
      "register": "modern",
      "source_id": "cc-cedict-editor-2026-08-11"
    },
    {
      "gloss": "to break open",
      "lang": "en",
      "register": "modern",
      "source_id": "cc-cedict-editor-2026-08-11"
    },
    {
      "gloss": "to rend",
      "lang": "en",
      "register": "modern",
      "source_id": "cc-cedict-editor-2026-08-11"
    }
  ],
  "definitions_zh_TW": [
    {
      "text": "破、分開。[例]破裂、分裂、四分五裂",
      "lang": "zh-Hant-TW",
      "register": "dictionary",
      "source_id": "moe-tw-concised-dictionary-2014-20260626",
      "source_entry_id": "1935",
      "verbatim": true
    }
  ],
  "frequency": {
    "rank": 1956,
    "selection_rank": 1949,
    "corpus_id": "moe-tw-common-terms-1996",
    "count": 37,
    "cumulative_count": 981154,
    "cumulative_percentage": 97.54418127,
    "per_million": 36.784589,
    "corpus_total_count": 1005856
  },
  "grading": {
    "hsk": null,
    "tocfl": null
  },
  "confusable_with": null,
  "kangxi_citation": "1116.180",
  "sources": {
    "codepoint": [
      "moe-tw-common-terms-1996"
    ],
    "traditional": [
      "moe-tw-common-terms-1996"
    ],
    "variants_異體字": [
      "unicode-unihan-17.0.0"
    ],
    "total_strokes": [
      "moe-tw-common-terms-1996"
    ],
    "total_strokes_standard": [
      "moe-tw-common-terms-1996"
    ],
    "stroke_count_variants": [
      "cns11643-attributes-2026-08-05",
      "unicode-unihan-17.0.0",
      "makemeahanzi-graphics-master-audit"
    ],
    "frequency": [
      "moe-tw-common-terms-1996"
    ],
    "simplified": [
      "cc-cedict-editor-2026-08-11"
    ],
    "radical.kangxi_number": [
      "cns11643-attributes-2026-08-05"
    ],
    "radical.residual_strokes": [
      "unicode-unihan-17.0.0"
    ],
    "radical.source_assignment": [
      "unicode-unihan-17.0.0"
    ],
    "radical.additional_assignments": [
      "unicode-unihan-17.0.0"
    ],
    "ids_decomposition": [
      "makemeahanzi-dictionary-master-audit"
    ],
    "components": [
      "makemeahanzi-dictionary-master-audit"
    ],
    "liushu_六書": [
      "makemeahanzi-dictionary-master-audit"
    ],
    "readings.pinyin": [
      "moe-tw-revised-dictionary-2015-20260625",
      "cns11643-attributes-2026-08-05",
      "unicode-unihan-17.0.0"
    ],
    "readings.zhuyin": [
      "moe-tw-revised-dictionary-2015-20260625",
      "cns11643-attributes-2026-08-05",
      "unicode-unihan-17.0.0"
    ],
    "readings.pinyin_variants": [
      "unicode-unihan-17.0.0"
    ],
    "readings.jyutping": [
      "unicode-unihan-17.0.0"
    ],
    "readings.japanese_on": [
      "unicode-unihan-17.0.0"
    ],
    "readings.japanese_kun": [
      "unicode-unihan-17.0.0"
    ],
    "readings.korean": [
      "unicode-unihan-17.0.0"
    ],
    "readings.fanqie": [
      "unicode-unihan-17.0.0"
    ],
    "readings.hangul": [
      "unicode-unihan-17.0.0"
    ],
    "definitions": [
      "unicode-unihan-17.0.0",
      "cc-cedict-editor-2026-08-11"
    ],
    "definitions_zh_TW": [
      "moe-tw-concised-dictionary-2014-20260626"
    ],
    "kangxi_citation": [
      "unicode-unihan-17.0.0"
    ],
    "english_translation": [
      "unicode-unihan-17.0.0"
    ],
    "common_words": [
      "moe-tw-common-terms-1996",
      "cc-cedict-editor-2026-08-11"
    ],
    "stroke_order.svg_asset_id": [
      "makemeahanzi-graphics-master-audit"
    ],
    "stroke_order.standard": [
      "prc-stroke-order-gf0023-2020"
    ],
    "stroke_order.source_convention": [
      "makemeahanzi-graphics-master-audit"
    ],
    "stroke_order.formal_conformance": [
      "makemeahanzi-graphics-master-audit",
      "prc-stroke-order-gf0023-2020"
    ],
    "stroke_order.stroke_count": [
      "makemeahanzi-graphics-master-audit"
    ],
    "stroke_order.taiwan_cns_stroke_sequence": [
      "cns11643-attributes-2026-08-05"
    ]
  },
  "gaps": [
    {
      "field": "simplification_note",
      "reason": "not_attested",
      "detail": "The approved mapping sources do not attest multiple Traditional origins for the selected Simplified character."
    },
    {
      "field": "grading.hsk",
      "reason": "source_unavailable",
      "detail": "No versioned redistribution-approved HSK character-level source passed the Phase 0 audit."
    },
    {
      "field": "grading.tocfl",
      "reason": "source_unavailable",
      "detail": "No versioned redistribution-approved TOCFL character-level source passed the Phase 0 audit."
    },
    {
      "field": "confusable_with",
      "reason": "source_unavailable",
      "detail": "No approved curated visual-confusables source passed the Phase 0 audit."
    },
    {
      "field": "stroke_order.stroke_types",
      "reason": "source_unavailable",
      "detail": "Make Me a Hanzi supplies ordered paths but no authoritative per-path stroke-type names; Taiwan CNS types are retained separately and are not assigned to PRC path indices."
    },
    {
      "field": "stroke_order.formal_standard_verification",
      "reason": "source_unavailable",
      "detail": "The GF 0023-2020 publication is reference-only and the path source claims PRC convention without formal per-character conformance evidence."
    }
  ],
  "conflicts": [],
  "english_translation": "split, crack, break open; rend",
  "common_words": [
    "moe1996-05095",
    "moe1996-12230",
    "moe1996-16726",
    "moe1996-21815",
    "moe1996-21816",
    "moe1996-21817",
    "moe1996-22908",
    "moe1996-23605",
    "moe1996-30369",
    "moe1996-34701"
  ],
  "stroke_order": {
    "svg_asset_id": "stroke-order-U+88C2-mmah-bddc96d4",
    "standard": "PRC GF 0023-2020 (provisional baseline)",
    "source_convention": "Make Me a Hanzi PRC stroke order",
    "formal_conformance": "not_verified",
    "stroke_count": 12,
    "stroke_types": null,
    "taiwan_cns_stroke_sequence": [
      {
        "code": "1",
        "name_zh": "橫"
      },
      {
        "code": "3",
        "name_zh": "撇"
      },
      {
        "code": "5",
        "name_zh": "折"
      },
      {
        "code": "4",
        "name_zh": "點"
      },
      {
        "code": "2",
        "name_zh": "豎"
      },
      {
        "code": "5",
        "name_zh": "折"
      },
      {
        "code": "4",
        "name_zh": "點"
      },
      {
        "code": "1",
        "name_zh": "橫"
      },
      {
        "code": "3",
        "name_zh": "撇"
      },
      {
        "code": "5",
        "name_zh": "折"
      },
      {
        "code": "3",
        "name_zh": "撇"
      },
      {
        "code": "4",
        "name_zh": "點"
      }
    ],
    "standard_conflicts": []
  }
}
