{
  "codepoint": "U+66FE",
  "traditional": "曾",
  "simplified": "曾",
  "simplification_note": null,
  "variants_異體字": [],
  "radical": {
    "kangxi_number": 73,
    "residual_strokes": 8,
    "source_assignment": "73.8",
    "additional_assignments": []
  },
  "total_strokes": 12,
  "total_strokes_standard": "TW-MOE-1996",
  "stroke_count_variants": [],
  "ids_decomposition": null,
  "components": null,
  "liushu_六書": {
    "source_type": "ideographic",
    "type": null,
    "semantic_component": null,
    "phonetic_component": null,
    "hint": "A rice cooker on heat 日, building up steam 丷 and letting it off"
  },
  "readings": {
    "pinyin": [
      {
        "reading": "zēng",
        "context": "primary",
        "region": "TW",
        "standard": "TW-MOE-Revised-2015",
        "source_entry_ids": [
          "09572"
        ]
      },
      {
        "reading": "céng",
        "context": "additional",
        "region": "TW",
        "standard": "TW-MOE-Revised-2015",
        "source_entry_ids": [
          "09802"
        ]
      }
    ],
    "zhuyin": [
      "ㄗㄥ",
      "ㄘㄥˊ"
    ],
    "jyutping": [
      "zang1"
    ],
    "japanese_on": [
      "SO",
      "SOU",
      "ZOU"
    ],
    "japanese_kun": [
      "KATTE",
      "SUNAWACHI"
    ],
    "korean": [
      "CUNG"
    ],
    "fanqie": [
      "作滕",
      "昨楞"
    ],
    "hangul": [
      "증"
    ]
  },
  "definitions": [
    {
      "gloss": "already; sign of past",
      "lang": "en",
      "register": "modern",
      "source_id": "unicode-unihan-17.0.0"
    },
    {
      "gloss": "surname Zeng",
      "lang": "en",
      "register": "modern",
      "source_id": "cc-cedict-editor-2026-08-11"
    },
    {
      "gloss": "once",
      "lang": "en",
      "register": "modern",
      "source_id": "cc-cedict-editor-2026-08-11"
    },
    {
      "gloss": "already",
      "lang": "en",
      "register": "modern",
      "source_id": "cc-cedict-editor-2026-08-11"
    },
    {
      "gloss": "ever (in the past)",
      "lang": "en",
      "register": "modern",
      "source_id": "cc-cedict-editor-2026-08-11"
    },
    {
      "gloss": "former",
      "lang": "en",
      "register": "modern",
      "source_id": "cc-cedict-editor-2026-08-11"
    },
    {
      "gloss": "previously",
      "lang": "en",
      "register": "modern",
      "source_id": "cc-cedict-editor-2026-08-11"
    },
    {
      "gloss": "(past tense marker used before verb or clause)",
      "lang": "en",
      "register": "modern",
      "source_id": "cc-cedict-editor-2026-08-11"
    },
    {
      "gloss": "great- (grandfather, grandchild etc)",
      "lang": "en",
      "register": "modern",
      "source_id": "cc-cedict-editor-2026-08-11"
    }
  ],
  "definitions_zh_TW": [
    {
      "text": "1.重疊的、中間隔兩代親屬關係的。[例]曾孫、曾祖父\n2.姓。",
      "lang": "zh-Hant-TW",
      "register": "dictionary",
      "source_id": "moe-tw-concised-dictionary-2014-20260626",
      "source_entry_id": "5367",
      "verbatim": true
    },
    {
      "text": "嘗，表示過去發生過、經歷過。[例]曾經、未曾、似曾",
      "lang": "zh-Hant-TW",
      "register": "dictionary",
      "source_id": "moe-tw-concised-dictionary-2014-20260626",
      "source_entry_id": "5488",
      "verbatim": true
    }
  ],
  "frequency": {
    "rank": 438,
    "selection_rank": 438,
    "corpus_id": "moe-tw-common-terms-1996",
    "count": 565,
    "cumulative_count": 727722,
    "cumulative_percentage": 72.34852703,
    "per_million": 561.710623,
    "corpus_total_count": 1005856
  },
  "grading": {
    "hsk": null,
    "tocfl": null
  },
  "confusable_with": null,
  "kangxi_citation": "0503.030",
  "sources": {
    "codepoint": [
      "moe-tw-common-terms-1996"
    ],
    "traditional": [
      "moe-tw-common-terms-1996"
    ],
    "variants_異體字": [
      "unicode-unihan-17.0.0"
    ],
    "total_strokes": [
      "moe-tw-common-terms-1996"
    ],
    "total_strokes_standard": [
      "moe-tw-common-terms-1996"
    ],
    "stroke_count_variants": [
      "cns11643-attributes-2026-08-05",
      "unicode-unihan-17.0.0",
      "makemeahanzi-graphics-master-audit"
    ],
    "frequency": [
      "moe-tw-common-terms-1996"
    ],
    "simplified": [
      "cc-cedict-editor-2026-08-11"
    ],
    "radical.kangxi_number": [
      "cns11643-attributes-2026-08-05"
    ],
    "radical.residual_strokes": [
      "unicode-unihan-17.0.0"
    ],
    "radical.source_assignment": [
      "unicode-unihan-17.0.0"
    ],
    "radical.additional_assignments": [
      "unicode-unihan-17.0.0"
    ],
    "liushu_六書": [
      "makemeahanzi-dictionary-master-audit"
    ],
    "readings.pinyin": [
      "moe-tw-revised-dictionary-2015-20260625",
      "cns11643-attributes-2026-08-05",
      "unicode-unihan-17.0.0"
    ],
    "readings.zhuyin": [
      "moe-tw-revised-dictionary-2015-20260625",
      "cns11643-attributes-2026-08-05",
      "unicode-unihan-17.0.0"
    ],
    "readings.jyutping": [
      "unicode-unihan-17.0.0"
    ],
    "readings.japanese_on": [
      "unicode-unihan-17.0.0"
    ],
    "readings.japanese_kun": [
      "unicode-unihan-17.0.0"
    ],
    "readings.korean": [
      "unicode-unihan-17.0.0"
    ],
    "readings.fanqie": [
      "unicode-unihan-17.0.0"
    ],
    "readings.hangul": [
      "unicode-unihan-17.0.0"
    ],
    "definitions": [
      "unicode-unihan-17.0.0",
      "cc-cedict-editor-2026-08-11"
    ],
    "definitions_zh_TW": [
      "moe-tw-concised-dictionary-2014-20260626"
    ],
    "kangxi_citation": [
      "unicode-unihan-17.0.0"
    ],
    "english_translation": [
      "unicode-unihan-17.0.0"
    ],
    "common_words": [
      "moe-tw-common-terms-1996",
      "cc-cedict-editor-2026-08-11"
    ],
    "stroke_order.svg_asset_id": [
      "makemeahanzi-graphics-master-audit"
    ],
    "stroke_order.standard": [
      "prc-stroke-order-gf0023-2020"
    ],
    "stroke_order.source_convention": [
      "makemeahanzi-graphics-master-audit"
    ],
    "stroke_order.formal_conformance": [
      "makemeahanzi-graphics-master-audit",
      "prc-stroke-order-gf0023-2020"
    ],
    "stroke_order.stroke_count": [
      "makemeahanzi-graphics-master-audit"
    ],
    "stroke_order.taiwan_cns_stroke_sequence": [
      "cns11643-attributes-2026-08-05"
    ]
  },
  "gaps": [
    {
      "field": "simplification_note",
      "reason": "not_attested",
      "detail": "The approved mapping sources do not attest multiple Traditional origins for the selected Simplified character."
    },
    {
      "field": "ids_decomposition",
      "reason": "not_attested",
      "detail": "Make Me a Hanzi marks the decomposition as wholly or partly unknown."
    },
    {
      "field": "components",
      "reason": "not_attested",
      "detail": "Components are not emitted from an unknown decomposition."
    },
    {
      "field": "liushu_六書.type",
      "reason": "source_unavailable",
      "detail": "The source's broad category is preserved but not forced into a more specific traditional 六書 category."
    },
    {
      "field": "liushu_六書.semantic_component",
      "reason": "not_attested",
      "detail": "The source category does not attest a separate semantic component."
    },
    {
      "field": "liushu_六書.phonetic_component",
      "reason": "not_attested",
      "detail": "The source category does not attest a separate phonetic component."
    },
    {
      "field": "grading.hsk",
      "reason": "source_unavailable",
      "detail": "No versioned redistribution-approved HSK character-level source passed the Phase 0 audit."
    },
    {
      "field": "grading.tocfl",
      "reason": "source_unavailable",
      "detail": "No versioned redistribution-approved TOCFL character-level source passed the Phase 0 audit."
    },
    {
      "field": "confusable_with",
      "reason": "source_unavailable",
      "detail": "No approved curated visual-confusables source passed the Phase 0 audit."
    },
    {
      "field": "common_words",
      "reason": "not_attested",
      "detail": "Only 7 distinct MOE-ranked rows with an exact CC-CEDICT Traditional headword were available."
    },
    {
      "field": "stroke_order.stroke_types",
      "reason": "source_unavailable",
      "detail": "Make Me a Hanzi supplies ordered paths but no authoritative per-path stroke-type names; Taiwan CNS types are retained separately and are not assigned to PRC path indices."
    },
    {
      "field": "stroke_order.formal_standard_verification",
      "reason": "source_unavailable",
      "detail": "The GF 0023-2020 publication is reference-only and the path source claims PRC convention without formal per-character conformance evidence."
    }
  ],
  "conflicts": [],
  "english_translation": "already; sign of past",
  "common_words": [
    "moe1996-00186",
    "moe1996-00853",
    "moe1996-02979",
    "moe1996-08668",
    "moe1996-09145",
    "moe1996-09812",
    "moe1996-21572"
  ],
  "stroke_order": {
    "svg_asset_id": "stroke-order-U+66FE-mmah-bddc96d4",
    "standard": "PRC GF 0023-2020 (provisional baseline)",
    "source_convention": "Make Me a Hanzi PRC stroke order",
    "formal_conformance": "not_verified",
    "stroke_count": 12,
    "stroke_types": null,
    "taiwan_cns_stroke_sequence": [
      {
        "code": "4",
        "name_zh": "點"
      },
      {
        "code": "3",
        "name_zh": "撇"
      },
      {
        "code": "2",
        "name_zh": "豎"
      },
      {
        "code": "5",
        "name_zh": "折"
      },
      {
        "code": "2",
        "name_zh": "豎"
      },
      {
        "code": "4",
        "name_zh": "點"
      },
      {
        "code": "3",
        "name_zh": "撇"
      },
      {
        "code": "1",
        "name_zh": "橫"
      },
      {
        "code": "2",
        "name_zh": "豎"
      },
      {
        "code": "5",
        "name_zh": "折"
      },
      {
        "code": "1",
        "name_zh": "橫"
      },
      {
        "code": "1",
        "name_zh": "橫"
      }
    ],
    "standard_conflicts": []
  }
}
