{
  "codepoint": "U+5348",
  "traditional": "午",
  "simplified": "午",
  "simplification_note": null,
  "variants_異體字": [],
  "radical": {
    "kangxi_number": 24,
    "residual_strokes": 2,
    "source_assignment": "24.2",
    "additional_assignments": []
  },
  "total_strokes": 4,
  "total_strokes_standard": "TW-MOE-1996",
  "stroke_count_variants": [],
  "ids_decomposition": "⿻丿干",
  "components": null,
  "liushu_六書": null,
  "readings": {
    "pinyin": [
      {
        "reading": "huo",
        "context": "primary",
        "region": "TW",
        "standard": "TW-MOE-Revised-2015",
        "source_entry_ids": [
          "05068"
        ]
      },
      {
        "reading": "wǔ",
        "context": "additional",
        "region": "TW",
        "standard": "TW-MOE-Revised-2015",
        "source_entry_ids": [
          "11257"
        ]
      }
    ],
    "zhuyin": [
      "˙ㄏㄨㄛ",
      "ㄨˇ"
    ],
    "jyutping": [
      "ng5"
    ],
    "japanese_on": [
      "GO"
    ],
    "japanese_kun": [
      "UMA"
    ],
    "korean": [
      "O"
    ],
    "fanqie": [
      "疑古"
    ],
    "hangul": [
      "오"
    ]
  },
  "definitions": [
    {
      "gloss": "seventh earthly branch",
      "lang": "en",
      "register": "modern",
      "source_id": "unicode-unihan-17.0.0"
    },
    {
      "gloss": "7th earthly branch: 11 a.m.-1 p.m., noon, 5th solar month (6th June-6th July), year of the Horse",
      "lang": "en",
      "register": "modern",
      "source_id": "cc-cedict-editor-2026-08-11"
    },
    {
      "gloss": "ancient Chinese compass point: 180° (south)",
      "lang": "en",
      "register": "modern",
      "source_id": "cc-cedict-editor-2026-08-11"
    }
  ],
  "definitions_zh_TW": [
    {
      "text": "正中午。[例]晌午",
      "lang": "zh-Hant-TW",
      "register": "dictionary",
      "source_id": "moe-tw-concised-dictionary-2014-20260626",
      "source_entry_id": "2876",
      "verbatim": true
    },
    {
      "text": "1.地支的第七位。\n2.時辰名。約當上午十一時到下午一時。[例]午時\n3.泛指白天或夜晚的中間時段。[例]中午、午餐、午夜",
      "lang": "zh-Hant-TW",
      "register": "dictionary",
      "source_id": "moe-tw-concised-dictionary-2014-20260626",
      "source_entry_id": "6247",
      "verbatim": true
    }
  ],
  "frequency": {
    "rank": 686,
    "selection_rank": 685,
    "corpus_id": "moe-tw-common-terms-1996",
    "count": 309,
    "cumulative_count": 832911,
    "cumulative_percentage": 82.80618697,
    "per_million": 307.201031,
    "corpus_total_count": 1005856
  },
  "grading": {
    "hsk": null,
    "tocfl": null
  },
  "confusable_with": null,
  "kangxi_citation": "0156.040",
  "sources": {
    "codepoint": [
      "moe-tw-common-terms-1996"
    ],
    "traditional": [
      "moe-tw-common-terms-1996"
    ],
    "variants_異體字": [
      "unicode-unihan-17.0.0"
    ],
    "total_strokes": [
      "moe-tw-common-terms-1996"
    ],
    "total_strokes_standard": [
      "moe-tw-common-terms-1996"
    ],
    "stroke_count_variants": [
      "cns11643-attributes-2026-08-05",
      "unicode-unihan-17.0.0",
      "makemeahanzi-graphics-master-audit"
    ],
    "frequency": [
      "moe-tw-common-terms-1996"
    ],
    "simplified": [
      "cc-cedict-editor-2026-08-11"
    ],
    "radical.kangxi_number": [
      "cns11643-attributes-2026-08-05"
    ],
    "radical.residual_strokes": [
      "unicode-unihan-17.0.0"
    ],
    "radical.source_assignment": [
      "unicode-unihan-17.0.0"
    ],
    "radical.additional_assignments": [
      "unicode-unihan-17.0.0"
    ],
    "ids_decomposition": [
      "makemeahanzi-dictionary-master-audit"
    ],
    "readings.pinyin": [
      "moe-tw-revised-dictionary-2015-20260625",
      "cns11643-attributes-2026-08-05",
      "unicode-unihan-17.0.0"
    ],
    "readings.zhuyin": [
      "moe-tw-revised-dictionary-2015-20260625",
      "cns11643-attributes-2026-08-05",
      "unicode-unihan-17.0.0"
    ],
    "readings.jyutping": [
      "unicode-unihan-17.0.0"
    ],
    "readings.japanese_on": [
      "unicode-unihan-17.0.0"
    ],
    "readings.japanese_kun": [
      "unicode-unihan-17.0.0"
    ],
    "readings.korean": [
      "unicode-unihan-17.0.0"
    ],
    "readings.fanqie": [
      "unicode-unihan-17.0.0"
    ],
    "readings.hangul": [
      "unicode-unihan-17.0.0"
    ],
    "definitions": [
      "unicode-unihan-17.0.0",
      "cc-cedict-editor-2026-08-11"
    ],
    "definitions_zh_TW": [
      "moe-tw-concised-dictionary-2014-20260626"
    ],
    "kangxi_citation": [
      "unicode-unihan-17.0.0"
    ],
    "english_translation": [
      "unicode-unihan-17.0.0"
    ],
    "common_words": [
      "moe-tw-common-terms-1996",
      "cc-cedict-editor-2026-08-11"
    ],
    "stroke_order.svg_asset_id": [
      "makemeahanzi-graphics-master-audit"
    ],
    "stroke_order.standard": [
      "prc-stroke-order-gf0023-2020"
    ],
    "stroke_order.source_convention": [
      "makemeahanzi-graphics-master-audit"
    ],
    "stroke_order.formal_conformance": [
      "makemeahanzi-graphics-master-audit",
      "prc-stroke-order-gf0023-2020"
    ],
    "stroke_order.stroke_count": [
      "makemeahanzi-graphics-master-audit"
    ],
    "stroke_order.taiwan_cns_stroke_sequence": [
      "cns11643-attributes-2026-08-05"
    ]
  },
  "gaps": [
    {
      "field": "simplification_note",
      "reason": "not_attested",
      "detail": "The approved mapping sources do not attest multiple Traditional origins for the selected Simplified character."
    },
    {
      "field": "components",
      "reason": "source_unavailable",
      "detail": "Component references outside the Phase 3 top-2,000 set are not emitted as dangling record references: U+4E3F"
    },
    {
      "field": "liushu_六書",
      "reason": "not_attested",
      "detail": "Make Me a Hanzi supplies no usable etymology classification."
    },
    {
      "field": "grading.hsk",
      "reason": "source_unavailable",
      "detail": "No versioned redistribution-approved HSK character-level source passed the Phase 0 audit."
    },
    {
      "field": "grading.tocfl",
      "reason": "source_unavailable",
      "detail": "No versioned redistribution-approved TOCFL character-level source passed the Phase 0 audit."
    },
    {
      "field": "confusable_with",
      "reason": "source_unavailable",
      "detail": "No approved curated visual-confusables source passed the Phase 0 audit."
    },
    {
      "field": "stroke_order.stroke_types",
      "reason": "source_unavailable",
      "detail": "Make Me a Hanzi supplies ordered paths but no authoritative per-path stroke-type names; Taiwan CNS types are retained separately and are not assigned to PRC path indices."
    },
    {
      "field": "stroke_order.formal_standard_verification",
      "reason": "source_unavailable",
      "detail": "The GF 0023-2020 publication is reference-only and the path source claims PRC convention without formal per-character conformance evidence."
    }
  ],
  "conflicts": [],
  "english_translation": "seventh earthly branch",
  "common_words": [
    "moe1996-00660",
    "moe1996-00881",
    "moe1996-02190",
    "moe1996-04778",
    "moe1996-06748",
    "moe1996-08499",
    "moe1996-09694",
    "moe1996-09695",
    "moe1996-17160",
    "moe1996-17563"
  ],
  "stroke_order": {
    "svg_asset_id": "stroke-order-U+5348-mmah-bddc96d4",
    "standard": "PRC GF 0023-2020 (provisional baseline)",
    "source_convention": "Make Me a Hanzi PRC stroke order",
    "formal_conformance": "not_verified",
    "stroke_count": 4,
    "stroke_types": null,
    "taiwan_cns_stroke_sequence": [
      {
        "code": "3",
        "name_zh": "撇"
      },
      {
        "code": "1",
        "name_zh": "橫"
      },
      {
        "code": "1",
        "name_zh": "橫"
      },
      {
        "code": "2",
        "name_zh": "豎"
      }
    ],
    "standard_conflicts": []
  }
}
